Run started: 2026-01-01T05:24:25.898599
Arguments: Namespace(source='marin', n_samples=[512, 1024, 4096, 8192, 16384, 32768], seq_len=4096, pooling_method='mean', model_path='plantcad/marin_exp2101__pcv2_pretrain_c4096__checkpoints', model_subfolder='checkpoints/plantcad_pretrain_fp32_v0.3', model_revision=None, seed=42, batch_size=32, device='cuda', dtype=torch.bfloat16, output_dir='results/sep/v27', force=True, species_filter='Zmays', species_filter_file=None, species_column='assembly', split='train', dataset_path='plantcad/Angiosperm_65_genomes_8192bp', dataset_config=None, dataset_revision='4a444fff5520b992aa978d92a5af509a81977098', text_column='seq', tokenization_mode='strict', dataset_sample_size=None, dataset_shuffle=False, dataset_dir=None, min_samples_per_class=2)

============================================================
Eigenspectrum Analysis of DNA Sequences
============================================================
Parameters:
  - Source: marin
  - Sample sizes: [512, 1024, 4096, 8192, 16384, 32768]
  - Sequence length: 4096 bp
  - Feature dimension: model hidden size
  - Pooling method: mean

Loading dataset from HuggingFace (path=plantcad/Angiosperm_65_genomes_8192bp, revision=4a444fff5520b992aa978d92a5af509a81977098, split=train)...
Resolving data files:   0%|          | 0/45 [00:00<?, ?it/s]Resolving data files:  27%|##6       | 12/45 [00:00<00:00, 80.43it/s]Resolving data files: 100%|##########| 45/45 [00:00<00:00, 301.29it/s]
Loading dataset shards:   0%|          | 0/44 [00:00<?, ?it/s]Loading dataset shards: 100%|##########| 44/44 [00:00<00:00, 6139.16it/s]
Dataset size: 2,638,656 records

Filtering data to species: Zmays
  Records before filtering: 2,638,656
Filtering to 1 species (num_proc=72):   0%|          | 0/2638656 [00:00<?, ? examples/s]Filtering to 1 species (num_proc=72):   0%|          | 1000/2638656 [00:00<09:15, 4747.32 examples/s]Filtering to 1 species (num_proc=72):   0%|          | 11000/2638656 [00:00<01:01, 42618.89 examples/s]Filtering to 1 species (num_proc=72):   1%|1         | 32000/2638656 [00:00<00:25, 101927.98 examples/s]Filtering to 1 species (num_proc=72):   2%|2         | 57000/2638656 [00:00<00:17, 151494.12 examples/s]Filtering to 1 species (num_proc=72):   3%|3         | 80000/2638656 [00:00<00:14, 175831.24 examples/s]Filtering to 1 species (num_proc=72):   4%|4         | 113000/2638656 [00:00<00:11, 223145.75 examples/s]Filtering to 1 species (num_proc=72):   6%|5         | 146000/2638656 [00:00<00:09, 255723.59 examples/s]Filtering to 1 species (num_proc=72):   7%|6         | 173000/2638656 [00:00<00:11, 217766.59 examples/s]Filtering to 1 species (num_proc=72):   8%|7         | 203000/2638656 [00:01<00:10, 239632.76 examples/s]Filtering to 1 species (num_proc=72):   9%|8         | 231000/2638656 [00:01<00:09, 250750.13 examples/s]Filtering to 1 species (num_proc=72):  10%|9         | 258000/2638656 [00:01<00:09, 247820.48 examples/s]Filtering to 1 species (num_proc=72):  11%|#         | 284000/2638656 [00:01<00:10, 235066.76 examples/s]Filtering to 1 species (num_proc=72):  12%|#1        | 309000/2638656 [00:01<00:10, 226372.79 examples/s]Filtering to 1 species (num_proc=72):  13%|#2        | 333000/2638656 [00:01<00:10, 226318.68 examples/s]Filtering to 1 species (num_proc=72):  14%|#3        | 368000/2638656 [00:01<00:08, 253975.27 examples/s]Filtering to 1 species (num_proc=72):  15%|#4        | 394000/2638656 [00:01<00:09, 230483.30 examples/s]Filtering to 1 species (num_proc=72):  16%|#5        | 421000/2638656 [00:02<00:09, 238646.01 examples/s]Filtering to 1 species (num_proc=72):  17%|#6        | 446000/2638656 [00:02<00:09, 229655.90 examples/s]Filtering to 1 species (num_proc=72):  18%|#8        | 478000/2638656 [00:02<00:08, 244742.74 examples/s]Filtering to 1 species (num_proc=72):  19%|#9        | 506000/2638656 [00:02<00:08, 252711.85 examples/s]Filtering to 1 species (num_proc=72):  20%|##        | 532000/2638656 [00:02<00:09, 225234.58 examples/s]Filtering to 1 species (num_proc=72):  21%|##1       | 556000/2638656 [00:02<00:09, 221019.74 examples/s]Filtering to 1 species (num_proc=72):  23%|##2       | 594000/2638656 [00:02<00:07, 262708.99 examples/s]Filtering to 1 species (num_proc=72):  24%|##3       | 622000/2638656 [00:02<00:08, 248163.28 examples/s]Filtering to 1 species (num_proc=72):  25%|##4       | 648000/2638656 [00:02<00:08, 234111.24 examples/s]Filtering to 1 species (num_proc=72):  26%|##5       | 674000/2638656 [00:03<00:08, 224380.84 examples/s]Filtering to 1 species (num_proc=72):  26%|##6       | 697000/2638656 [00:03<00:08, 224094.95 examples/s]Filtering to 1 species (num_proc=72):  28%|##7       | 734000/2638656 [00:03<00:07, 260804.76 examples/s]Filtering to 1 species (num_proc=72):  29%|##8       | 761000/2638656 [00:03<00:08, 231766.93 examples/s]Filtering to 1 species (num_proc=72):  30%|##9       | 790000/2638656 [00:03<00:07, 246456.22 examples/s]Filtering to 1 species (num_proc=72):  31%|###       | 816000/2638656 [00:03<00:07, 228420.32 examples/s]Filtering to 1 species (num_proc=72):  32%|###2      | 855000/2638656 [00:03<00:06, 267762.64 examples/s]Filtering to 1 species (num_proc=72):  33%|###3      | 883000/2638656 [00:03<00:07, 248649.38 examples/s]Filtering to 1 species (num_proc=72):  34%|###4      | 909000/2638656 [00:04<00:07, 230017.52 examples/s]Filtering to 1 species (num_proc=72):  35%|###5      | 933648/2638656 [00:04<00:07, 226757.36 examples/s]Filtering to 1 species (num_proc=72):  36%|###6      | 957648/2638656 [00:04<00:07, 220837.82 examples/s]Filtering to 1 species (num_proc=72):  37%|###7      | 988648/2638656 [00:04<00:06, 244068.35 examples/s]Filtering to 1 species (num_proc=72):  38%|###8      | 1013648/2638656 [00:04<00:07, 216533.61 examples/s]Filtering to 1 species (num_proc=72):  39%|###9      | 1036648/2638656 [00:04<00:07, 217690.35 examples/s]Filtering to 1 species (num_proc=72):  40%|####      | 1063296/2638656 [00:04<00:06, 230367.71 examples/s]Filtering to 1 species (num_proc=72):  41%|####1     | 1086944/2638656 [00:04<00:06, 230290.02 examples/s]Filtering to 1 species (num_proc=72):  42%|####2     | 1113944/2638656 [00:04<00:06, 240432.10 examples/s]Filtering to 1 species (num_proc=72):  43%|####3     | 1138944/2638656 [00:05<00:06, 219595.43 examples/s]Filtering to 1 species (num_proc=72):  44%|####4     | 1166944/2638656 [00:05<00:06, 233346.93 examples/s]Filtering to 1 species (num_proc=72):  45%|####5     | 1190944/2638656 [00:05<00:06, 234773.35 examples/s]Filtering to 1 species (num_proc=72):  46%|####6     | 1214944/2638656 [00:05<00:06, 229959.70 examples/s]Filtering to 1 species (num_proc=72):  47%|####6     | 1238592/2638656 [00:05<00:06, 231487.00 examples/s]Filtering to 1 species (num_proc=72):  48%|####7     | 1266536/2638656 [00:05<00:05, 242421.14 examples/s]Filtering to 1 species (num_proc=72):  49%|####8     | 1291184/2638656 [00:05<00:06, 209118.05 examples/s]Filtering to 1 species (num_proc=72):  50%|####9     | 1313184/2638656 [00:05<00:06, 210614.84 examples/s]Filtering to 1 species (num_proc=72):  51%|#####1    | 1346128/2638656 [00:05<00:05, 232949.69 examples/s]Filtering to 1 species (num_proc=72):  52%|#####1    | 1370128/2638656 [00:06<00:06, 201038.32 examples/s]Filtering to 1 species (num_proc=72):  53%|#####2    | 1393128/2638656 [00:06<00:06, 202272.63 examples/s]Filtering to 1 species (num_proc=72):  54%|#####3    | 1414776/2638656 [00:06<00:06, 199588.33 examples/s]Filtering to 1 species (num_proc=72):  55%|#####4    | 1441776/2638656 [00:06<00:05, 214471.57 examples/s]Filtering to 1 species (num_proc=72):  56%|#####5    | 1464776/2638656 [00:06<00:05, 210048.64 examples/s]Filtering to 1 species (num_proc=72):  56%|#####6    | 1486424/2638656 [00:06<00:06, 175133.80 examples/s]Filtering to 1 species (num_proc=72):  57%|#####7    | 1514424/2638656 [00:06<00:05, 200153.20 examples/s]Filtering to 1 species (num_proc=72):  58%|#####8    | 1536424/2638656 [00:06<00:05, 204547.83 examples/s]Filtering to 1 species (num_proc=72):  59%|#####9    | 1558072/2638656 [00:07<00:05, 183739.23 examples/s]Filtering to 1 species (num_proc=72):  60%|#####9    | 1578368/2638656 [00:07<00:06, 160450.88 examples/s]Filtering to 1 species (num_proc=72):  61%|######    | 1597368/2638656 [00:07<00:06, 162993.60 examples/s]Filtering to 1 species (num_proc=72):  62%|######1   | 1623016/2638656 [00:07<00:05, 185996.33 examples/s]Filtering to 1 species (num_proc=72):  62%|######2   | 1643664/2638656 [00:07<00:06, 145967.30 examples/s]Filtering to 1 species (num_proc=72):  63%|######2   | 1660664/2638656 [00:07<00:07, 127165.64 examples/s]Filtering to 1 species (num_proc=72):  64%|######3   | 1675664/2638656 [00:07<00:07, 130175.05 examples/s]Filtering to 1 species (num_proc=72):  64%|######4   | 1691664/2638656 [00:08<00:07, 135127.43 examples/s]Filtering to 1 species (num_proc=72):  65%|######4   | 1706664/2638656 [00:08<00:07, 131799.19 examples/s]Filtering to 1 species (num_proc=72):  65%|######5   | 1720664/2638656 [00:08<00:07, 129487.91 examples/s]Filtering to 1 species (num_proc=72):  66%|######5   | 1734664/2638656 [00:08<00:08, 102837.72 examples/s]Filtering to 1 species (num_proc=72):  66%|######6   | 1752664/2638656 [00:08<00:07, 119287.43 examples/s]Filtering to 1 species (num_proc=72):  67%|######7   | 1769664/2638656 [00:08<00:06, 130271.17 examples/s]Filtering to 1 species (num_proc=72):  68%|######7   | 1784312/2638656 [00:08<00:07, 114850.56 examples/s]Filtering to 1 species (num_proc=72):  68%|######8   | 1797312/2638656 [00:09<00:08, 104828.52 examples/s]Filtering to 1 species (num_proc=72):  69%|######8   | 1812312/2638656 [00:09<00:07, 114971.32 examples/s]Filtering to 1 species (num_proc=72):  69%|######9   | 1832312/2638656 [00:09<00:06, 133771.66 examples/s]Filtering to 1 species (num_proc=72):  70%|#######   | 1847312/2638656 [00:09<00:06, 118747.63 examples/s]Filtering to 1 species (num_proc=72):  71%|#######   | 1860312/2638656 [00:09<00:06, 112676.67 examples/s]Filtering to 1 species (num_proc=72):  71%|#######   | 1872312/2638656 [00:09<00:06, 110751.03 examples/s]Filtering to 1 species (num_proc=72):  71%|#######1  | 1883960/2638656 [00:09<00:06, 112093.29 examples/s]Filtering to 1 species (num_proc=72):  72%|#######2  | 1901904/2638656 [00:09<00:05, 125905.11 examples/s]Filtering to 1 species (num_proc=72):  73%|#######2  | 1915552/2638656 [00:10<00:06, 115551.51 examples/s]Filtering to 1 species (num_proc=72):  73%|#######3  | 1927552/2638656 [00:10<00:06, 114938.19 examples/s]Filtering to 1 species (num_proc=72):  74%|#######3  | 1940200/2638656 [00:10<00:06, 111633.13 examples/s]Filtering to 1 species (num_proc=72):  74%|#######3  | 1952200/2638656 [00:10<00:07, 91176.96 examples/s] Filtering to 1 species (num_proc=72):  75%|#######4  | 1970200/2638656 [00:10<00:06, 108435.01 examples/s]Filtering to 1 species (num_proc=72):  75%|#######5  | 1982200/2638656 [00:10<00:07, 90932.35 examples/s] Filtering to 1 species (num_proc=72):  76%|#######5  | 1993200/2638656 [00:10<00:07, 88611.56 examples/s]Filtering to 1 species (num_proc=72):  76%|#######5  | 2002848/2638656 [00:11<00:07, 84798.61 examples/s]Filtering to 1 species (num_proc=72):  77%|#######6  | 2019848/2638656 [00:11<00:05, 103507.02 examples/s]Filtering to 1 species (num_proc=72):  77%|#######7  | 2031848/2638656 [00:11<00:06, 95177.02 examples/s] Filtering to 1 species (num_proc=72):  78%|#######7  | 2046848/2638656 [00:11<00:05, 107951.22 examples/s]Filtering to 1 species (num_proc=72):  78%|#######8  | 2058848/2638656 [00:11<00:05, 106790.56 examples/s]Filtering to 1 species (num_proc=72):  78%|#######8  | 2070848/2638656 [00:11<00:05, 105446.24 examples/s]Filtering to 1 species (num_proc=72):  79%|#######9  | 2086848/2638656 [00:11<00:04, 119179.83 examples/s]Filtering to 1 species (num_proc=72):  80%|#######9  | 2101496/2638656 [00:11<00:04, 122694.12 examples/s]Filtering to 1 species (num_proc=72):  80%|########  | 2114144/2638656 [00:11<00:04, 111660.21 examples/s]Filtering to 1 species (num_proc=72):  81%|########  | 2126144/2638656 [00:12<00:04, 107886.50 examples/s]Filtering to 1 species (num_proc=72):  81%|########1 | 2142792/2638656 [00:12<00:04, 121140.93 examples/s]Filtering to 1 species (num_proc=72):  82%|########1 | 2155792/2638656 [00:12<00:04, 115701.78 examples/s]Filtering to 1 species (num_proc=72):  82%|########2 | 2168440/2638656 [00:12<00:04, 101965.78 examples/s]Filtering to 1 species (num_proc=72):  83%|########2 | 2180088/2638656 [00:12<00:04, 105500.27 examples/s]Filtering to 1 species (num_proc=72):  83%|########3 | 2192088/2638656 [00:12<00:04, 102117.77 examples/s]Filtering to 1 species (num_proc=72):  83%|########3 | 2203088/2638656 [00:12<00:04, 94409.44 examples/s] Filtering to 1 species (num_proc=72):  84%|########3 | 2213088/2638656 [00:12<00:04, 90188.79 examples/s]Filtering to 1 species (num_proc=72):  84%|########4 | 2223384/2638656 [00:13<00:04, 92394.89 examples/s]Filtering to 1 species (num_proc=72):  85%|########4 | 2234384/2638656 [00:13<00:04, 96329.00 examples/s]Filtering to 1 species (num_proc=72):  85%|########5 | 2244384/2638656 [00:13<00:04, 93968.62 examples/s]Filtering to 1 species (num_proc=72):  85%|########5 | 2254384/2638656 [00:13<00:05, 75513.14 examples/s]Filtering to 1 species (num_proc=72):  86%|########6 | 2274384/2638656 [00:13<00:03, 104290.86 examples/s]Filtering to 1 species (num_proc=72):  87%|########6 | 2286032/2638656 [00:13<00:03, 88541.30 examples/s] Filtering to 1 species (num_proc=72):  87%|########7 | 2297032/2638656 [00:13<00:03, 86223.45 examples/s]Filtering to 1 species (num_proc=72):  88%|########7 | 2310680/2638656 [00:14<00:03, 97149.94 examples/s]Filtering to 1 species (num_proc=72):  88%|########7 | 2321680/2638656 [00:14<00:03, 96749.15 examples/s]Filtering to 1 species (num_proc=72):  88%|########8 | 2332680/2638656 [00:14<00:03, 80709.89 examples/s]Filtering to 1 species (num_proc=72):  89%|########8 | 2343680/2638656 [00:14<00:03, 85258.95 examples/s]Filtering to 1 species (num_proc=72):  89%|########9 | 2356680/2638656 [00:14<00:03, 93628.04 examples/s]Filtering to 1 species (num_proc=72):  90%|########9 | 2367328/2638656 [00:14<00:02, 96348.09 examples/s]Filtering to 1 species (num_proc=72):  90%|######### | 2377624/2638656 [00:14<00:02, 87934.83 examples/s]Filtering to 1 species (num_proc=72):  90%|######### | 2387568/2638656 [00:14<00:02, 89751.08 examples/s]Filtering to 1 species (num_proc=72):  91%|#########1| 2401216/2638656 [00:15<00:02, 96234.98 examples/s]Filtering to 1 species (num_proc=72):  91%|#########1| 2411864/2638656 [00:15<00:02, 77019.12 examples/s]Filtering to 1 species (num_proc=72):  92%|#########1| 2420864/2638656 [00:15<00:02, 76310.99 examples/s]Filtering to 1 species (num_proc=72):  92%|#########2| 2429512/2638656 [00:15<00:02, 72789.18 examples/s]Filtering to 1 species (num_proc=72):  92%|#########2| 2437512/2638656 [00:15<00:03, 57355.97 examples/s]Filtering to 1 species (num_proc=72):  93%|#########2| 2452512/2638656 [00:15<00:02, 70503.84 examples/s]Filtering to 1 species (num_proc=72):  93%|#########3| 2461160/2638656 [00:16<00:02, 59842.27 examples/s]Filtering to 1 species (num_proc=72):  94%|#########3| 2472160/2638656 [00:16<00:02, 68704.02 examples/s]Filtering to 1 species (num_proc=72):  94%|#########3| 2480160/2638656 [00:16<00:02, 65536.37 examples/s]Filtering to 1 species (num_proc=72):  94%|#########4| 2488160/2638656 [00:16<00:02, 55507.28 examples/s]Filtering to 1 species (num_proc=72):  95%|#########4| 2497160/2638656 [00:16<00:02, 61391.59 examples/s]Filtering to 1 species (num_proc=72):  95%|#########4| 2504160/2638656 [00:16<00:02, 55065.51 examples/s]Filtering to 1 species (num_proc=72):  95%|#########5| 2516160/2638656 [00:16<00:01, 68776.12 examples/s]Filtering to 1 species (num_proc=72):  96%|#########5| 2524160/2638656 [00:17<00:01, 58055.55 examples/s]Filtering to 1 species (num_proc=72):  96%|#########5| 2530808/2638656 [00:17<00:01, 59096.98 examples/s]Filtering to 1 species (num_proc=72):  96%|#########6| 2540808/2638656 [00:17<00:01, 68346.01 examples/s]Filtering to 1 species (num_proc=72):  97%|#########6| 2548456/2638656 [00:17<00:01, 64683.42 examples/s]Filtering to 1 species (num_proc=72):  97%|#########6| 2559104/2638656 [00:17<00:01, 72494.68 examples/s]Filtering to 1 species (num_proc=72):  97%|#########7| 2567696/2638656 [00:17<00:01, 61858.50 examples/s]Filtering to 1 species (num_proc=72):  98%|#########7| 2576992/2638656 [00:17<00:00, 67761.63 examples/s]Filtering to 1 species (num_proc=72):  98%|#########7| 2584936/2638656 [00:17<00:00, 68491.62 examples/s]Filtering to 1 species (num_proc=72):  98%|#########8| 2592584/2638656 [00:18<00:00, 55426.24 examples/s]Filtering to 1 species (num_proc=72):  99%|#########8| 2599584/2638656 [00:18<00:00, 50107.81 examples/s]Filtering to 1 species (num_proc=72):  99%|#########8| 2605584/2638656 [00:18<00:00, 42702.18 examples/s]Filtering to 1 species (num_proc=72):  99%|#########8| 2611232/2638656 [00:18<00:00, 42943.22 examples/s]Filtering to 1 species (num_proc=72):  99%|#########9| 2616232/2638656 [00:18<00:00, 39204.15 examples/s]Filtering to 1 species (num_proc=72):  99%|#########9| 2622880/2638656 [00:18<00:00, 43736.40 examples/s]Filtering to 1 species (num_proc=72): 100%|#########9| 2627824/2638656 [00:19<00:00, 44870.19 examples/s]Filtering to 1 species (num_proc=72): 100%|#########9| 2633416/2638656 [00:19<00:00, 44143.06 examples/s]Filtering to 1 species (num_proc=72): 100%|##########| 2638656/2638656 [00:19<00:00, 136306.46 examples/s]
  Records after filtering: 43,643

Preparing sequences (cropping to 4096 bp and filtering empty)...
  Records before filtering: 43,643
Cropping sequences (num_proc=72):   0%|          | 0/43643 [00:00<?, ? examples/s]Cropping sequences (num_proc=72):   1%|1         | 607/43643 [00:00<00:07, 5978.85 examples/s]Cropping sequences (num_proc=72):  38%|###7      | 16375/43643 [00:00<00:00, 93640.21 examples/s]Cropping sequences (num_proc=72):  60%|#####9    | 26098/43643 [00:00<00:00, 85570.36 examples/s]Cropping sequences (num_proc=72): 100%|##########| 43643/43643 [00:00<00:00, 86329.77 examples/s]
Filtering empty sequences (num_proc=72):   0%|          | 0/43643 [00:00<?, ? examples/s]Filtering empty sequences (num_proc=72):  14%|#3        | 6070/43643 [00:00<00:00, 60388.20 examples/s]Filtering empty sequences (num_proc=72):  54%|#####4    | 23645/43643 [00:00<00:00, 106669.82 examples/s]Filtering empty sequences (num_proc=72): 100%|##########| 43643/43643 [00:00<00:00, 96201.44 examples/s] 
  Records after filtering: 43,643
  Empty sequences filtered: 0
Sampling 32768 records...
Extracting records...
  Unique species: 1
Loading AutoModelForCausalLM from plantcad/marin_exp2101__pcv2_pretrain_c4096__checkpoints subfolder=checkpoints/plantcad_pretrain_fp32_v0.3 with dtype=torch.bfloat16...
  Hidden size: 384
  Parameters: 9,450,624 (9.5M)
  Device: cuda, Dtype: torch.bfloat16
  Model:
Qwen2ForCausalLM(
  (model): Qwen2Model(
    (embed_tokens): Embedding(7, 384)
    (layers): ModuleList(
      (0-3): 4 x Qwen2DecoderLayer(
        (self_attn): Qwen2Attention(
          (q_proj): Linear(in_features=384, out_features=384, bias=True)
          (k_proj): Linear(in_features=384, out_features=384, bias=True)
          (v_proj): Linear(in_features=384, out_features=384, bias=True)
          (o_proj): Linear(in_features=384, out_features=384, bias=False)
        )
        (mlp): Qwen2MLP(
          (gate_proj): Linear(in_features=384, out_features=1536, bias=False)
          (up_proj): Linear(in_features=384, out_features=1536, bias=False)
          (down_proj): Linear(in_features=1536, out_features=384, bias=False)
          (act_fn): SiLU()
        )
        (input_layernorm): Qwen2RMSNorm((384,), eps=1e-06)
        (post_attention_layernorm): Qwen2RMSNorm((384,), eps=1e-06)
      )
    )
    (norm): Qwen2RMSNorm((384,), eps=1e-06)
    (rotary_emb): Qwen2RotaryEmbedding()
  )
  (lm_head): Linear(in_features=384, out_features=7, bias=False)
)
Extracting embeddings:   0%|          | 0/1024 [00:00<?, ?it/s]Extracting embeddings:   0%|          | 1/1024 [00:00<03:05,  5.50it/s]Extracting embeddings:   0%|          | 3/1024 [00:00<01:33, 10.93it/s]Extracting embeddings:   0%|          | 5/1024 [00:00<01:15, 13.41it/s]Extracting embeddings:   1%|          | 7/1024 [00:00<01:08, 14.76it/s]Extracting embeddings:   1%|          | 9/1024 [00:00<01:05, 15.55it/s]Extracting embeddings:   1%|1         | 11/1024 [00:00<01:03, 16.03it/s]Extracting embeddings:   1%|1         | 13/1024 [00:00<01:01, 16.34it/s]Extracting embeddings:   1%|1         | 15/1024 [00:01<01:00, 16.55it/s]Extracting embeddings:   2%|1         | 17/1024 [00:01<01:00, 16.69it/s]Extracting embeddings:   2%|1         | 19/1024 [00:01<00:59, 16.79it/s]Extracting embeddings:   2%|2         | 21/1024 [00:01<00:59, 16.86it/s]Extracting embeddings:   2%|2         | 23/1024 [00:01<00:59, 16.90it/s]Extracting embeddings:   2%|2         | 25/1024 [00:01<00:59, 16.93it/s]Extracting embeddings:   3%|2         | 27/1024 [00:01<00:58, 16.95it/s]Extracting embeddings:   3%|2         | 29/1024 [00:01<00:58, 16.97it/s]Extracting embeddings:   3%|3         | 31/1024 [00:01<00:58, 16.98it/s]Extracting embeddings:   3%|3         | 33/1024 [00:02<00:58, 16.99it/s]Extracting embeddings:   3%|3         | 35/1024 [00:02<00:58, 16.99it/s]Extracting embeddings:   4%|3         | 37/1024 [00:02<00:58, 17.00it/s]Extracting embeddings:   4%|3         | 39/1024 [00:02<00:57, 16.99it/s]Extracting embeddings:   4%|4         | 41/1024 [00:02<00:57, 16.99it/s]Extracting embeddings:   4%|4         | 43/1024 [00:02<00:57, 16.99it/s]Extracting embeddings:   4%|4         | 45/1024 [00:02<00:57, 17.00it/s]Extracting embeddings:   5%|4         | 47/1024 [00:02<00:57, 17.00it/s]Extracting embeddings:   5%|4         | 49/1024 [00:03<00:57, 16.99it/s]Extracting embeddings:   5%|4         | 51/1024 [00:03<00:57, 17.00it/s]Extracting embeddings:   5%|5         | 53/1024 [00:03<00:57, 17.00it/s]Extracting embeddings:   5%|5         | 55/1024 [00:03<00:56, 17.00it/s]Extracting embeddings:   6%|5         | 57/1024 [00:03<00:56, 17.00it/s]Extracting embeddings:   6%|5         | 59/1024 [00:03<00:56, 17.01it/s]Extracting embeddings:   6%|5         | 61/1024 [00:03<00:56, 17.01it/s]Extracting embeddings:   6%|6         | 63/1024 [00:03<00:56, 17.00it/s]Extracting embeddings:   6%|6         | 65/1024 [00:03<00:56, 16.99it/s]Extracting embeddings:   7%|6         | 67/1024 [00:04<00:56, 17.00it/s]Extracting embeddings:   7%|6         | 69/1024 [00:04<00:56, 16.98it/s]Extracting embeddings:   7%|6         | 71/1024 [00:04<00:56, 16.98it/s]Extracting embeddings:   7%|7         | 73/1024 [00:04<00:56, 16.98it/s]Extracting embeddings:   7%|7         | 75/1024 [00:04<00:55, 16.98it/s]Extracting embeddings:   8%|7         | 77/1024 [00:04<00:55, 16.98it/s]Extracting embeddings:   8%|7         | 79/1024 [00:04<00:55, 16.99it/s]Extracting embeddings:   8%|7         | 81/1024 [00:04<00:55, 16.99it/s]Extracting embeddings:   8%|8         | 83/1024 [00:05<00:55, 16.99it/s]Extracting embeddings:   8%|8         | 85/1024 [00:05<00:55, 16.99it/s]Extracting embeddings:   8%|8         | 87/1024 [00:05<00:55, 16.99it/s]Extracting embeddings:   9%|8         | 89/1024 [00:05<00:55, 16.99it/s]Extracting embeddings:   9%|8         | 91/1024 [00:05<00:54, 16.99it/s]Extracting embeddings:   9%|9         | 93/1024 [00:05<00:54, 16.99it/s]Extracting embeddings:   9%|9         | 95/1024 [00:05<00:54, 16.98it/s]Extracting embeddings:   9%|9         | 97/1024 [00:05<00:54, 16.99it/s]Extracting embeddings:  10%|9         | 99/1024 [00:05<00:54, 16.99it/s]Extracting embeddings:  10%|9         | 101/1024 [00:06<00:54, 16.99it/s]Extracting embeddings:  10%|#         | 103/1024 [00:06<00:54, 16.98it/s]Extracting embeddings:  10%|#         | 105/1024 [00:06<00:54, 16.98it/s]Extracting embeddings:  10%|#         | 107/1024 [00:06<00:53, 16.98it/s]Extracting embeddings:  11%|#         | 109/1024 [00:06<00:53, 16.97it/s]Extracting embeddings:  11%|#         | 111/1024 [00:06<00:53, 16.97it/s]Extracting embeddings:  11%|#1        | 113/1024 [00:06<00:53, 16.97it/s]Extracting embeddings:  11%|#1        | 115/1024 [00:06<00:53, 16.98it/s]Extracting embeddings:  11%|#1        | 117/1024 [00:07<00:53, 16.99it/s]Extracting embeddings:  12%|#1        | 119/1024 [00:07<00:53, 17.00it/s]Extracting embeddings:  12%|#1        | 121/1024 [00:07<00:53, 17.01it/s]Extracting embeddings:  12%|#2        | 123/1024 [00:07<00:53, 16.99it/s]Extracting embeddings:  12%|#2        | 125/1024 [00:07<00:52, 16.99it/s]Extracting embeddings:  12%|#2        | 127/1024 [00:07<00:52, 16.98it/s]Extracting embeddings:  13%|#2        | 129/1024 [00:07<00:52, 16.98it/s]Extracting embeddings:  13%|#2        | 131/1024 [00:07<00:52, 16.99it/s]Extracting embeddings:  13%|#2        | 133/1024 [00:07<00:52, 17.00it/s]Extracting embeddings:  13%|#3        | 135/1024 [00:08<00:52, 16.99it/s]Extracting embeddings:  13%|#3        | 137/1024 [00:08<00:52, 17.00it/s]Extracting embeddings:  14%|#3        | 139/1024 [00:08<00:52, 17.00it/s]Extracting embeddings:  14%|#3        | 141/1024 [00:08<00:51, 17.00it/s]Extracting embeddings:  14%|#3        | 143/1024 [00:08<00:51, 16.99it/s]Extracting embeddings:  14%|#4        | 145/1024 [00:08<00:51, 16.98it/s]Extracting embeddings:  14%|#4        | 147/1024 [00:08<00:51, 16.97it/s]Extracting embeddings:  15%|#4        | 149/1024 [00:08<00:51, 16.97it/s]Extracting embeddings:  15%|#4        | 151/1024 [00:09<00:51, 16.97it/s]Extracting embeddings:  15%|#4        | 153/1024 [00:09<00:51, 16.97it/s]Extracting embeddings:  15%|#5        | 155/1024 [00:09<00:51, 16.98it/s]Extracting embeddings:  15%|#5        | 157/1024 [00:09<00:51, 16.97it/s]Extracting embeddings:  16%|#5        | 159/1024 [00:09<00:51, 16.94it/s]Extracting embeddings:  16%|#5        | 161/1024 [00:09<00:50, 16.95it/s]Extracting embeddings:  16%|#5        | 163/1024 [00:09<00:50, 16.96it/s]Extracting embeddings:  16%|#6        | 165/1024 [00:09<00:50, 16.97it/s]Extracting embeddings:  16%|#6        | 167/1024 [00:09<00:50, 16.96it/s]Extracting embeddings:  17%|#6        | 169/1024 [00:10<00:50, 16.96it/s]Extracting embeddings:  17%|#6        | 171/1024 [00:10<00:50, 16.97it/s]Extracting embeddings:  17%|#6        | 173/1024 [00:10<00:50, 16.96it/s]Extracting embeddings:  17%|#7        | 175/1024 [00:10<00:50, 16.96it/s]Extracting embeddings:  17%|#7        | 177/1024 [00:10<00:49, 16.96it/s]Extracting embeddings:  17%|#7        | 179/1024 [00:10<00:49, 16.96it/s]Extracting embeddings:  18%|#7        | 181/1024 [00:10<00:49, 16.97it/s]Extracting embeddings:  18%|#7        | 183/1024 [00:10<00:49, 16.98it/s]Extracting embeddings:  18%|#8        | 185/1024 [00:11<00:49, 16.99it/s]Extracting embeddings:  18%|#8        | 187/1024 [00:11<00:49, 16.99it/s]Extracting embeddings:  18%|#8        | 189/1024 [00:11<00:49, 16.99it/s]Extracting embeddings:  19%|#8        | 191/1024 [00:11<00:49, 16.99it/s]Extracting embeddings:  19%|#8        | 193/1024 [00:11<00:48, 16.99it/s]Extracting embeddings:  19%|#9        | 195/1024 [00:11<00:48, 16.99it/s]Extracting embeddings:  19%|#9        | 197/1024 [00:11<00:48, 16.99it/s]Extracting embeddings:  19%|#9        | 199/1024 [00:11<00:48, 17.00it/s]Extracting embeddings:  20%|#9        | 201/1024 [00:11<00:48, 16.99it/s]Extracting embeddings:  20%|#9        | 203/1024 [00:12<00:48, 16.99it/s]Extracting embeddings:  20%|##        | 205/1024 [00:12<00:48, 16.98it/s]Extracting embeddings:  20%|##        | 207/1024 [00:12<00:48, 16.97it/s]Extracting embeddings:  20%|##        | 209/1024 [00:12<00:48, 16.97it/s]Extracting embeddings:  21%|##        | 211/1024 [00:12<00:47, 16.97it/s]Extracting embeddings:  21%|##        | 213/1024 [00:12<00:47, 16.99it/s]Extracting embeddings:  21%|##        | 215/1024 [00:12<00:47, 16.99it/s]Extracting embeddings:  21%|##1       | 217/1024 [00:12<00:47, 16.99it/s]Extracting embeddings:  21%|##1       | 219/1024 [00:13<00:47, 17.00it/s]Extracting embeddings:  22%|##1       | 221/1024 [00:13<00:47, 17.00it/s]Extracting embeddings:  22%|##1       | 223/1024 [00:13<00:47, 17.00it/s]Extracting embeddings:  22%|##1       | 225/1024 [00:13<00:47, 16.99it/s]Extracting embeddings:  22%|##2       | 227/1024 [00:13<00:46, 17.00it/s]Extracting embeddings:  22%|##2       | 229/1024 [00:13<00:46, 17.00it/s]Extracting embeddings:  23%|##2       | 231/1024 [00:13<00:46, 17.00it/s]Extracting embeddings:  23%|##2       | 233/1024 [00:13<00:46, 16.99it/s]Extracting embeddings:  23%|##2       | 235/1024 [00:13<00:46, 16.99it/s]Extracting embeddings:  23%|##3       | 237/1024 [00:14<00:46, 17.00it/s]Extracting embeddings:  23%|##3       | 239/1024 [00:14<00:46, 16.99it/s]Extracting embeddings:  24%|##3       | 241/1024 [00:14<00:46, 17.00it/s]Extracting embeddings:  24%|##3       | 243/1024 [00:14<00:45, 17.01it/s]Extracting embeddings:  24%|##3       | 245/1024 [00:14<00:45, 17.02it/s]Extracting embeddings:  24%|##4       | 247/1024 [00:14<00:45, 17.02it/s]Extracting embeddings:  24%|##4       | 249/1024 [00:14<00:45, 17.03it/s]Extracting embeddings:  25%|##4       | 251/1024 [00:14<00:45, 17.03it/s]Extracting embeddings:  25%|##4       | 253/1024 [00:15<00:45, 17.03it/s]Extracting embeddings:  25%|##4       | 255/1024 [00:15<00:45, 17.04it/s]Extracting embeddings:  25%|##5       | 257/1024 [00:15<00:45, 17.04it/s]Extracting embeddings:  25%|##5       | 259/1024 [00:15<00:44, 17.03it/s]Extracting embeddings:  25%|##5       | 261/1024 [00:15<00:44, 17.02it/s]Extracting embeddings:  26%|##5       | 263/1024 [00:15<00:44, 17.03it/s]Extracting embeddings:  26%|##5       | 265/1024 [00:15<00:44, 17.02it/s]Extracting embeddings:  26%|##6       | 267/1024 [00:15<00:44, 17.03it/s]Extracting embeddings:  26%|##6       | 269/1024 [00:15<00:44, 17.04it/s]Extracting embeddings:  26%|##6       | 271/1024 [00:16<00:44, 17.04it/s]Extracting embeddings:  27%|##6       | 273/1024 [00:16<00:44, 17.03it/s]Extracting embeddings:  27%|##6       | 275/1024 [00:16<00:43, 17.03it/s]Extracting embeddings:  27%|##7       | 277/1024 [00:16<00:43, 17.04it/s]Extracting embeddings:  27%|##7       | 279/1024 [00:16<00:43, 17.05it/s]Extracting embeddings:  27%|##7       | 281/1024 [00:16<00:43, 17.06it/s]Extracting embeddings:  28%|##7       | 283/1024 [00:16<00:43, 17.06it/s]Extracting embeddings:  28%|##7       | 285/1024 [00:16<00:43, 17.04it/s]Extracting embeddings:  28%|##8       | 287/1024 [00:17<00:43, 17.04it/s]Extracting embeddings:  28%|##8       | 289/1024 [00:17<00:43, 17.03it/s]Extracting embeddings:  28%|##8       | 291/1024 [00:17<00:43, 17.03it/s]Extracting embeddings:  29%|##8       | 293/1024 [00:17<00:42, 17.03it/s]Extracting embeddings:  29%|##8       | 295/1024 [00:17<00:42, 17.03it/s]Extracting embeddings:  29%|##9       | 297/1024 [00:17<00:42, 17.03it/s]Extracting embeddings:  29%|##9       | 299/1024 [00:17<00:42, 17.03it/s]Extracting embeddings:  29%|##9       | 301/1024 [00:17<00:42, 17.03it/s]Extracting embeddings:  30%|##9       | 303/1024 [00:17<00:42, 17.03it/s]Extracting embeddings:  30%|##9       | 305/1024 [00:18<00:42, 17.02it/s]Extracting embeddings:  30%|##9       | 307/1024 [00:18<00:42, 17.03it/s]Extracting embeddings:  30%|###       | 309/1024 [00:18<00:41, 17.04it/s]Extracting embeddings:  30%|###       | 311/1024 [00:18<00:41, 17.04it/s]Extracting embeddings:  31%|###       | 313/1024 [00:18<00:41, 17.04it/s]Extracting embeddings:  31%|###       | 315/1024 [00:18<00:41, 17.04it/s]Extracting embeddings:  31%|###       | 317/1024 [00:18<00:41, 17.00it/s]Extracting embeddings:  31%|###1      | 319/1024 [00:18<00:41, 17.01it/s]Extracting embeddings:  31%|###1      | 321/1024 [00:19<00:41, 17.01it/s]Extracting embeddings:  32%|###1      | 323/1024 [00:19<00:41, 17.02it/s]Extracting embeddings:  32%|###1      | 325/1024 [00:19<00:41, 17.03it/s]Extracting embeddings:  32%|###1      | 327/1024 [00:19<00:40, 17.03it/s]Extracting embeddings:  32%|###2      | 329/1024 [00:19<00:40, 17.03it/s]Extracting embeddings:  32%|###2      | 331/1024 [00:19<00:40, 17.03it/s]Extracting embeddings:  33%|###2      | 333/1024 [00:19<00:40, 17.02it/s]Extracting embeddings:  33%|###2      | 335/1024 [00:19<00:40, 17.02it/s]Extracting embeddings:  33%|###2      | 337/1024 [00:19<00:40, 17.01it/s]Extracting embeddings:  33%|###3      | 339/1024 [00:20<00:40, 17.02it/s]Extracting embeddings:  33%|###3      | 341/1024 [00:20<00:40, 17.03it/s]Extracting embeddings:  33%|###3      | 343/1024 [00:20<00:39, 17.03it/s]Extracting embeddings:  34%|###3      | 345/1024 [00:20<00:39, 17.02it/s]Extracting embeddings:  34%|###3      | 347/1024 [00:20<00:39, 17.03it/s]Extracting embeddings:  34%|###4      | 349/1024 [00:20<00:39, 17.04it/s]Extracting embeddings:  34%|###4      | 351/1024 [00:20<00:39, 17.03it/s]Extracting embeddings:  34%|###4      | 353/1024 [00:20<00:39, 17.03it/s]Extracting embeddings:  35%|###4      | 355/1024 [00:21<00:39, 17.04it/s]Extracting embeddings:  35%|###4      | 357/1024 [00:21<00:39, 17.03it/s]Extracting embeddings:  35%|###5      | 359/1024 [00:21<00:39, 17.02it/s]Extracting embeddings:  35%|###5      | 361/1024 [00:21<00:38, 17.02it/s]Extracting embeddings:  35%|###5      | 363/1024 [00:21<00:38, 17.02it/s]Extracting embeddings:  36%|###5      | 365/1024 [00:21<00:38, 17.01it/s]Extracting embeddings:  36%|###5      | 367/1024 [00:21<00:38, 17.01it/s]Extracting embeddings:  36%|###6      | 369/1024 [00:21<00:38, 17.00it/s]Extracting embeddings:  36%|###6      | 371/1024 [00:21<00:38, 17.00it/s]Extracting embeddings:  36%|###6      | 373/1024 [00:22<00:38, 16.99it/s]Extracting embeddings:  37%|###6      | 375/1024 [00:22<00:38, 17.01it/s]Extracting embeddings:  37%|###6      | 377/1024 [00:22<00:38, 16.99it/s]Extracting embeddings:  37%|###7      | 379/1024 [00:22<00:37, 17.00it/s]Extracting embeddings:  37%|###7      | 381/1024 [00:22<00:37, 17.01it/s]Extracting embeddings:  37%|###7      | 383/1024 [00:22<00:37, 17.02it/s]Extracting embeddings:  38%|###7      | 385/1024 [00:22<00:37, 17.02it/s]Extracting embeddings:  38%|###7      | 387/1024 [00:22<00:37, 17.01it/s]Extracting embeddings:  38%|###7      | 389/1024 [00:23<00:37, 17.02it/s]Extracting embeddings:  38%|###8      | 391/1024 [00:23<00:37, 17.02it/s]Extracting embeddings:  38%|###8      | 393/1024 [00:23<00:37, 17.02it/s]Extracting embeddings:  39%|###8      | 395/1024 [00:23<00:36, 17.01it/s]Extracting embeddings:  39%|###8      | 397/1024 [00:23<00:36, 17.01it/s]Extracting embeddings:  39%|###8      | 399/1024 [00:23<00:36, 17.00it/s]Extracting embeddings:  39%|###9      | 401/1024 [00:23<00:36, 17.01it/s]Extracting embeddings:  39%|###9      | 403/1024 [00:23<00:36, 17.01it/s]Extracting embeddings:  40%|###9      | 405/1024 [00:23<00:36, 17.01it/s]Extracting embeddings:  40%|###9      | 407/1024 [00:24<00:36, 17.01it/s]Extracting embeddings:  40%|###9      | 409/1024 [00:24<00:36, 17.02it/s]Extracting embeddings:  40%|####      | 411/1024 [00:24<00:36, 17.02it/s]Extracting embeddings:  40%|####      | 413/1024 [00:24<00:35, 17.01it/s]Extracting embeddings:  41%|####      | 415/1024 [00:24<00:35, 17.01it/s]Extracting embeddings:  41%|####      | 417/1024 [00:24<00:35, 17.00it/s]Extracting embeddings:  41%|####      | 419/1024 [00:24<00:35, 16.99it/s]Extracting embeddings:  41%|####1     | 421/1024 [00:24<00:35, 16.99it/s]Extracting embeddings:  41%|####1     | 423/1024 [00:25<00:35, 16.99it/s]Extracting embeddings:  42%|####1     | 425/1024 [00:25<00:35, 17.01it/s]Extracting embeddings:  42%|####1     | 427/1024 [00:25<00:35, 17.01it/s]Extracting embeddings:  42%|####1     | 429/1024 [00:25<00:34, 17.00it/s]Extracting embeddings:  42%|####2     | 431/1024 [00:25<00:34, 17.00it/s]Extracting embeddings:  42%|####2     | 433/1024 [00:25<00:34, 17.00it/s]Extracting embeddings:  42%|####2     | 435/1024 [00:25<00:34, 17.00it/s]Extracting embeddings:  43%|####2     | 437/1024 [00:25<00:34, 17.00it/s]Extracting embeddings:  43%|####2     | 439/1024 [00:25<00:34, 17.00it/s]Extracting embeddings:  43%|####3     | 441/1024 [00:26<00:34, 17.00it/s]Extracting embeddings:  43%|####3     | 443/1024 [00:26<00:34, 17.01it/s]Extracting embeddings:  43%|####3     | 445/1024 [00:26<00:34, 17.01it/s]Extracting embeddings:  44%|####3     | 447/1024 [00:26<00:33, 16.99it/s]Extracting embeddings:  44%|####3     | 449/1024 [00:26<00:33, 16.99it/s]Extracting embeddings:  44%|####4     | 451/1024 [00:26<00:33, 16.99it/s]Extracting embeddings:  44%|####4     | 453/1024 [00:26<00:33, 16.98it/s]Extracting embeddings:  44%|####4     | 455/1024 [00:26<00:33, 16.99it/s]Extracting embeddings:  45%|####4     | 457/1024 [00:27<00:33, 16.99it/s]Extracting embeddings:  45%|####4     | 459/1024 [00:27<00:33, 16.99it/s]Extracting embeddings:  45%|####5     | 461/1024 [00:27<00:33, 17.01it/s]Extracting embeddings:  45%|####5     | 463/1024 [00:27<00:32, 17.01it/s]Extracting embeddings:  45%|####5     | 465/1024 [00:27<00:32, 17.00it/s]Extracting embeddings:  46%|####5     | 467/1024 [00:27<00:32, 17.01it/s]Extracting embeddings:  46%|####5     | 469/1024 [00:27<00:32, 17.01it/s]Extracting embeddings:  46%|####5     | 471/1024 [00:27<00:32, 17.01it/s]Extracting embeddings:  46%|####6     | 473/1024 [00:27<00:32, 16.95it/s]Extracting embeddings:  46%|####6     | 475/1024 [00:28<00:32, 16.97it/s]Extracting embeddings:  47%|####6     | 477/1024 [00:28<00:32, 16.99it/s]Extracting embeddings:  47%|####6     | 479/1024 [00:28<00:32, 17.00it/s]Extracting embeddings:  47%|####6     | 481/1024 [00:28<00:31, 17.00it/s]Extracting embeddings:  47%|####7     | 483/1024 [00:28<00:31, 17.00it/s]Extracting embeddings:  47%|####7     | 485/1024 [00:28<00:31, 17.00it/s]Extracting embeddings:  48%|####7     | 487/1024 [00:28<00:31, 17.00it/s]Extracting embeddings:  48%|####7     | 489/1024 [00:28<00:31, 16.99it/s]Extracting embeddings:  48%|####7     | 491/1024 [00:29<00:31, 16.99it/s]Extracting embeddings:  48%|####8     | 493/1024 [00:29<00:31, 17.00it/s]Extracting embeddings:  48%|####8     | 495/1024 [00:29<00:31, 17.00it/s]Extracting embeddings:  49%|####8     | 497/1024 [00:29<00:30, 17.00it/s]Extracting embeddings:  49%|####8     | 499/1024 [00:29<00:30, 17.00it/s]Extracting embeddings:  49%|####8     | 501/1024 [00:29<00:30, 17.00it/s]Extracting embeddings:  49%|####9     | 503/1024 [00:29<00:30, 17.00it/s]Extracting embeddings:  49%|####9     | 505/1024 [00:29<00:30, 17.00it/s]Extracting embeddings:  50%|####9     | 507/1024 [00:29<00:30, 17.00it/s]Extracting embeddings:  50%|####9     | 509/1024 [00:30<00:30, 17.00it/s]Extracting embeddings:  50%|####9     | 511/1024 [00:30<00:30, 16.99it/s]Extracting embeddings:  50%|#####     | 513/1024 [00:30<00:30, 17.00it/s]Extracting embeddings:  50%|#####     | 515/1024 [00:30<00:29, 17.00it/s]Extracting embeddings:  50%|#####     | 517/1024 [00:30<00:29, 17.00it/s]Extracting embeddings:  51%|#####     | 519/1024 [00:30<00:29, 17.01it/s]Extracting embeddings:  51%|#####     | 521/1024 [00:30<00:29, 17.01it/s]Extracting embeddings:  51%|#####1    | 523/1024 [00:30<00:29, 17.02it/s]Extracting embeddings:  51%|#####1    | 525/1024 [00:31<00:29, 17.02it/s]Extracting embeddings:  51%|#####1    | 527/1024 [00:31<00:29, 17.02it/s]Extracting embeddings:  52%|#####1    | 529/1024 [00:31<00:29, 17.03it/s]Extracting embeddings:  52%|#####1    | 531/1024 [00:31<00:28, 17.03it/s]Extracting embeddings:  52%|#####2    | 533/1024 [00:31<00:28, 17.03it/s]Extracting embeddings:  52%|#####2    | 535/1024 [00:31<00:28, 17.03it/s]Extracting embeddings:  52%|#####2    | 537/1024 [00:31<00:28, 17.02it/s]Extracting embeddings:  53%|#####2    | 539/1024 [00:31<00:28, 17.02it/s]Extracting embeddings:  53%|#####2    | 541/1024 [00:31<00:28, 17.02it/s]Extracting embeddings:  53%|#####3    | 543/1024 [00:32<00:28, 17.01it/s]Extracting embeddings:  53%|#####3    | 545/1024 [00:32<00:28, 17.01it/s]Extracting embeddings:  53%|#####3    | 547/1024 [00:32<00:28, 17.01it/s]Extracting embeddings:  54%|#####3    | 549/1024 [00:32<00:27, 17.01it/s]Extracting embeddings:  54%|#####3    | 551/1024 [00:32<00:27, 17.02it/s]Extracting embeddings:  54%|#####4    | 553/1024 [00:32<00:27, 17.01it/s]Extracting embeddings:  54%|#####4    | 555/1024 [00:32<00:27, 17.01it/s]Extracting embeddings:  54%|#####4    | 557/1024 [00:32<00:27, 17.01it/s]Extracting embeddings:  55%|#####4    | 559/1024 [00:32<00:27, 17.02it/s]Extracting embeddings:  55%|#####4    | 561/1024 [00:33<00:27, 17.02it/s]Extracting embeddings:  55%|#####4    | 563/1024 [00:33<00:27, 17.02it/s]Extracting embeddings:  55%|#####5    | 565/1024 [00:33<00:26, 17.02it/s]Extracting embeddings:  55%|#####5    | 567/1024 [00:33<00:26, 17.00it/s]Extracting embeddings:  56%|#####5    | 569/1024 [00:33<00:26, 17.00it/s]Extracting embeddings:  56%|#####5    | 571/1024 [00:33<00:26, 16.99it/s]Extracting embeddings:  56%|#####5    | 573/1024 [00:33<00:26, 16.98it/s]Extracting embeddings:  56%|#####6    | 575/1024 [00:33<00:26, 16.99it/s]Extracting embeddings:  56%|#####6    | 577/1024 [00:34<00:26, 17.00it/s]Extracting embeddings:  57%|#####6    | 579/1024 [00:34<00:26, 17.00it/s]Extracting embeddings:  57%|#####6    | 581/1024 [00:34<00:26, 17.00it/s]Extracting embeddings:  57%|#####6    | 583/1024 [00:34<00:25, 17.00it/s]Extracting embeddings:  57%|#####7    | 585/1024 [00:34<00:25, 17.01it/s]Extracting embeddings:  57%|#####7    | 587/1024 [00:34<00:25, 17.00it/s]Extracting embeddings:  58%|#####7    | 589/1024 [00:34<00:25, 16.99it/s]Extracting embeddings:  58%|#####7    | 591/1024 [00:34<00:25, 16.99it/s]Extracting embeddings:  58%|#####7    | 593/1024 [00:34<00:25, 17.00it/s]Extracting embeddings:  58%|#####8    | 595/1024 [00:35<00:25, 16.99it/s]Extracting embeddings:  58%|#####8    | 597/1024 [00:35<00:25, 17.00it/s]Extracting embeddings:  58%|#####8    | 599/1024 [00:35<00:24, 17.01it/s]Extracting embeddings:  59%|#####8    | 601/1024 [00:35<00:24, 17.01it/s]Extracting embeddings:  59%|#####8    | 603/1024 [00:35<00:24, 17.01it/s]Extracting embeddings:  59%|#####9    | 605/1024 [00:35<00:24, 17.00it/s]Extracting embeddings:  59%|#####9    | 607/1024 [00:35<00:24, 17.00it/s]Extracting embeddings:  59%|#####9    | 609/1024 [00:35<00:24, 17.00it/s]Extracting embeddings:  60%|#####9    | 611/1024 [00:36<00:24, 17.00it/s]Extracting embeddings:  60%|#####9    | 613/1024 [00:36<00:24, 17.00it/s]Extracting embeddings:  60%|######    | 615/1024 [00:36<00:24, 17.00it/s]Extracting embeddings:  60%|######    | 617/1024 [00:36<00:23, 17.00it/s]Extracting embeddings:  60%|######    | 619/1024 [00:36<00:23, 17.01it/s]Extracting embeddings:  61%|######    | 621/1024 [00:36<00:23, 17.01it/s]Extracting embeddings:  61%|######    | 623/1024 [00:36<00:23, 17.00it/s]Extracting embeddings:  61%|######1   | 625/1024 [00:36<00:23, 17.00it/s]Extracting embeddings:  61%|######1   | 627/1024 [00:36<00:23, 17.00it/s]Extracting embeddings:  61%|######1   | 629/1024 [00:37<00:23, 17.01it/s]Extracting embeddings:  62%|######1   | 631/1024 [00:37<00:23, 16.97it/s]Extracting embeddings:  62%|######1   | 633/1024 [00:37<00:23, 16.97it/s]Extracting embeddings:  62%|######2   | 635/1024 [00:37<00:22, 16.99it/s]Extracting embeddings:  62%|######2   | 637/1024 [00:37<00:22, 16.99it/s]Extracting embeddings:  62%|######2   | 639/1024 [00:37<00:22, 17.00it/s]Extracting embeddings:  63%|######2   | 641/1024 [00:37<00:22, 17.01it/s]Extracting embeddings:  63%|######2   | 643/1024 [00:37<00:22, 17.01it/s]Extracting embeddings:  63%|######2   | 645/1024 [00:38<00:22, 17.00it/s]Extracting embeddings:  63%|######3   | 647/1024 [00:38<00:22, 17.01it/s]Extracting embeddings:  63%|######3   | 649/1024 [00:38<00:22, 17.02it/s]Extracting embeddings:  64%|######3   | 651/1024 [00:38<00:21, 17.00it/s]Extracting embeddings:  64%|######3   | 653/1024 [00:38<00:21, 17.01it/s]Extracting embeddings:  64%|######3   | 655/1024 [00:38<00:21, 17.00it/s]Extracting embeddings:  64%|######4   | 657/1024 [00:38<00:21, 17.00it/s]Extracting embeddings:  64%|######4   | 659/1024 [00:38<00:21, 17.00it/s]Extracting embeddings:  65%|######4   | 661/1024 [00:38<00:21, 17.00it/s]Extracting embeddings:  65%|######4   | 663/1024 [00:39<00:21, 17.00it/s]Extracting embeddings:  65%|######4   | 665/1024 [00:39<00:21, 17.01it/s]Extracting embeddings:  65%|######5   | 667/1024 [00:39<00:21, 17.00it/s]Extracting embeddings:  65%|######5   | 669/1024 [00:39<00:20, 17.00it/s]Extracting embeddings:  66%|######5   | 671/1024 [00:39<00:20, 17.00it/s]Extracting embeddings:  66%|######5   | 673/1024 [00:39<00:20, 17.00it/s]Extracting embeddings:  66%|######5   | 675/1024 [00:39<00:20, 17.00it/s]Extracting embeddings:  66%|######6   | 677/1024 [00:39<00:20, 17.00it/s]Extracting embeddings:  66%|######6   | 679/1024 [00:40<00:20, 17.00it/s]Extracting embeddings:  67%|######6   | 681/1024 [00:40<00:20, 17.01it/s]Extracting embeddings:  67%|######6   | 683/1024 [00:40<00:20, 17.01it/s]Extracting embeddings:  67%|######6   | 685/1024 [00:40<00:19, 17.01it/s]Extracting embeddings:  67%|######7   | 687/1024 [00:40<00:19, 17.01it/s]Extracting embeddings:  67%|######7   | 689/1024 [00:40<00:19, 17.01it/s]Extracting embeddings:  67%|######7   | 691/1024 [00:40<00:19, 17.00it/s]Extracting embeddings:  68%|######7   | 693/1024 [00:40<00:19, 17.01it/s]Extracting embeddings:  68%|######7   | 695/1024 [00:40<00:19, 16.99it/s]Extracting embeddings:  68%|######8   | 697/1024 [00:41<00:19, 17.00it/s]Extracting embeddings:  68%|######8   | 699/1024 [00:41<00:19, 17.01it/s]Extracting embeddings:  68%|######8   | 701/1024 [00:41<00:18, 17.00it/s]Extracting embeddings:  69%|######8   | 703/1024 [00:41<00:18, 17.00it/s]Extracting embeddings:  69%|######8   | 705/1024 [00:41<00:18, 17.00it/s]Extracting embeddings:  69%|######9   | 707/1024 [00:41<00:18, 17.00it/s]Extracting embeddings:  69%|######9   | 709/1024 [00:41<00:18, 16.99it/s]Extracting embeddings:  69%|######9   | 711/1024 [00:41<00:18, 16.99it/s]Extracting embeddings:  70%|######9   | 713/1024 [00:42<00:18, 17.00it/s]Extracting embeddings:  70%|######9   | 715/1024 [00:42<00:18, 17.00it/s]Extracting embeddings:  70%|#######   | 717/1024 [00:42<00:18, 16.99it/s]Extracting embeddings:  70%|#######   | 719/1024 [00:42<00:17, 17.00it/s]Extracting embeddings:  70%|#######   | 721/1024 [00:42<00:17, 17.00it/s]Extracting embeddings:  71%|#######   | 723/1024 [00:42<00:17, 17.00it/s]Extracting embeddings:  71%|#######   | 725/1024 [00:42<00:17, 17.01it/s]Extracting embeddings:  71%|#######   | 727/1024 [00:42<00:17, 17.01it/s]Extracting embeddings:  71%|#######1  | 729/1024 [00:42<00:17, 17.01it/s]Extracting embeddings:  71%|#######1  | 731/1024 [00:43<00:17, 17.01it/s]Extracting embeddings:  72%|#######1  | 733/1024 [00:43<00:17, 17.00it/s]Extracting embeddings:  72%|#######1  | 735/1024 [00:43<00:16, 17.00it/s]Extracting embeddings:  72%|#######1  | 737/1024 [00:43<00:16, 17.00it/s]Extracting embeddings:  72%|#######2  | 739/1024 [00:43<00:16, 17.01it/s]Extracting embeddings:  72%|#######2  | 741/1024 [00:43<00:16, 17.00it/s]Extracting embeddings:  73%|#######2  | 743/1024 [00:43<00:16, 17.01it/s]Extracting embeddings:  73%|#######2  | 745/1024 [00:43<00:16, 17.00it/s]Extracting embeddings:  73%|#######2  | 747/1024 [00:44<00:16, 17.00it/s]Extracting embeddings:  73%|#######3  | 749/1024 [00:44<00:16, 17.00it/s]Extracting embeddings:  73%|#######3  | 751/1024 [00:44<00:16, 17.00it/s]Extracting embeddings:  74%|#######3  | 753/1024 [00:44<00:15, 17.00it/s]Extracting embeddings:  74%|#######3  | 755/1024 [00:44<00:15, 17.00it/s]Extracting embeddings:  74%|#######3  | 757/1024 [00:44<00:15, 16.99it/s]Extracting embeddings:  74%|#######4  | 759/1024 [00:44<00:15, 16.98it/s]Extracting embeddings:  74%|#######4  | 761/1024 [00:44<00:15, 16.99it/s]Extracting embeddings:  75%|#######4  | 763/1024 [00:44<00:15, 16.99it/s]Extracting embeddings:  75%|#######4  | 765/1024 [00:45<00:15, 16.98it/s]Extracting embeddings:  75%|#######4  | 767/1024 [00:45<00:15, 16.99it/s]Extracting embeddings:  75%|#######5  | 769/1024 [00:45<00:15, 16.98it/s]Extracting embeddings:  75%|#######5  | 771/1024 [00:45<00:14, 16.98it/s]Extracting embeddings:  75%|#######5  | 773/1024 [00:45<00:14, 16.99it/s]Extracting embeddings:  76%|#######5  | 775/1024 [00:45<00:14, 16.97it/s]Extracting embeddings:  76%|#######5  | 777/1024 [00:45<00:14, 16.98it/s]Extracting embeddings:  76%|#######6  | 779/1024 [00:45<00:14, 16.98it/s]Extracting embeddings:  76%|#######6  | 781/1024 [00:46<00:14, 16.98it/s]Extracting embeddings:  76%|#######6  | 783/1024 [00:46<00:14, 16.98it/s]Extracting embeddings:  77%|#######6  | 785/1024 [00:46<00:14, 17.00it/s]Extracting embeddings:  77%|#######6  | 787/1024 [00:46<00:13, 16.95it/s]Extracting embeddings:  77%|#######7  | 789/1024 [00:46<00:13, 16.97it/s]Extracting embeddings:  77%|#######7  | 791/1024 [00:46<00:13, 16.97it/s]Extracting embeddings:  77%|#######7  | 793/1024 [00:46<00:13, 16.97it/s]Extracting embeddings:  78%|#######7  | 795/1024 [00:46<00:13, 16.97it/s]Extracting embeddings:  78%|#######7  | 797/1024 [00:47<00:13, 16.97it/s]Extracting embeddings:  78%|#######8  | 799/1024 [00:47<00:13, 16.98it/s]Extracting embeddings:  78%|#######8  | 801/1024 [00:47<00:13, 16.98it/s]Extracting embeddings:  78%|#######8  | 803/1024 [00:47<00:13, 16.97it/s]Extracting embeddings:  79%|#######8  | 805/1024 [00:47<00:12, 16.97it/s]Extracting embeddings:  79%|#######8  | 807/1024 [00:47<00:12, 16.98it/s]Extracting embeddings:  79%|#######9  | 809/1024 [00:47<00:12, 16.97it/s]Extracting embeddings:  79%|#######9  | 811/1024 [00:47<00:12, 16.97it/s]Extracting embeddings:  79%|#######9  | 813/1024 [00:47<00:12, 16.97it/s]Extracting embeddings:  80%|#######9  | 815/1024 [00:48<00:12, 16.97it/s]Extracting embeddings:  80%|#######9  | 817/1024 [00:48<00:12, 16.97it/s]Extracting embeddings:  80%|#######9  | 819/1024 [00:48<00:12, 16.96it/s]Extracting embeddings:  80%|########  | 821/1024 [00:48<00:11, 16.97it/s]Extracting embeddings:  80%|########  | 823/1024 [00:48<00:11, 16.97it/s]Extracting embeddings:  81%|########  | 825/1024 [00:48<00:11, 16.97it/s]Extracting embeddings:  81%|########  | 827/1024 [00:48<00:11, 16.97it/s]Extracting embeddings:  81%|########  | 829/1024 [00:48<00:11, 16.96it/s]Extracting embeddings:  81%|########1 | 831/1024 [00:49<00:11, 16.97it/s]Extracting embeddings:  81%|########1 | 833/1024 [00:49<00:11, 16.98it/s]Extracting embeddings:  82%|########1 | 835/1024 [00:49<00:11, 16.97it/s]Extracting embeddings:  82%|########1 | 837/1024 [00:49<00:11, 16.98it/s]Extracting embeddings:  82%|########1 | 839/1024 [00:49<00:10, 16.98it/s]Extracting embeddings:  82%|########2 | 841/1024 [00:49<00:10, 16.98it/s]Extracting embeddings:  82%|########2 | 843/1024 [00:49<00:10, 16.99it/s]Extracting embeddings:  83%|########2 | 845/1024 [00:49<00:10, 16.99it/s]Extracting embeddings:  83%|########2 | 847/1024 [00:49<00:10, 16.98it/s]Extracting embeddings:  83%|########2 | 849/1024 [00:50<00:10, 16.99it/s]Extracting embeddings:  83%|########3 | 851/1024 [00:50<00:10, 16.98it/s]Extracting embeddings:  83%|########3 | 853/1024 [00:50<00:10, 16.98it/s]Extracting embeddings:  83%|########3 | 855/1024 [00:50<00:09, 16.98it/s]Extracting embeddings:  84%|########3 | 857/1024 [00:50<00:09, 16.97it/s]Extracting embeddings:  84%|########3 | 859/1024 [00:50<00:09, 16.98it/s]Extracting embeddings:  84%|########4 | 861/1024 [00:50<00:09, 16.98it/s]Extracting embeddings:  84%|########4 | 863/1024 [00:50<00:09, 16.97it/s]Extracting embeddings:  84%|########4 | 865/1024 [00:51<00:09, 16.97it/s]Extracting embeddings:  85%|########4 | 867/1024 [00:51<00:09, 16.97it/s]Extracting embeddings:  85%|########4 | 869/1024 [00:51<00:09, 16.97it/s]Extracting embeddings:  85%|########5 | 871/1024 [00:51<00:09, 16.96it/s]Extracting embeddings:  85%|########5 | 873/1024 [00:51<00:08, 16.97it/s]Extracting embeddings:  85%|########5 | 875/1024 [00:51<00:08, 16.97it/s]Extracting embeddings:  86%|########5 | 877/1024 [00:51<00:08, 16.97it/s]Extracting embeddings:  86%|########5 | 879/1024 [00:51<00:08, 16.97it/s]Extracting embeddings:  86%|########6 | 881/1024 [00:51<00:08, 16.98it/s]Extracting embeddings:  86%|########6 | 883/1024 [00:52<00:08, 16.97it/s]Extracting embeddings:  86%|########6 | 885/1024 [00:52<00:08, 16.97it/s]Extracting embeddings:  87%|########6 | 887/1024 [00:52<00:08, 16.98it/s]Extracting embeddings:  87%|########6 | 889/1024 [00:52<00:07, 16.98it/s]Extracting embeddings:  87%|########7 | 891/1024 [00:52<00:07, 16.98it/s]Extracting embeddings:  87%|########7 | 893/1024 [00:52<00:07, 16.98it/s]Extracting embeddings:  87%|########7 | 895/1024 [00:52<00:07, 16.98it/s]Extracting embeddings:  88%|########7 | 897/1024 [00:52<00:07, 16.97it/s]Extracting embeddings:  88%|########7 | 899/1024 [00:53<00:07, 16.97it/s]Extracting embeddings:  88%|########7 | 901/1024 [00:53<00:07, 16.97it/s]Extracting embeddings:  88%|########8 | 903/1024 [00:53<00:07, 16.97it/s]Extracting embeddings:  88%|########8 | 905/1024 [00:53<00:07, 16.96it/s]Extracting embeddings:  89%|########8 | 907/1024 [00:53<00:06, 16.96it/s]Extracting embeddings:  89%|########8 | 909/1024 [00:53<00:06, 16.97it/s]Extracting embeddings:  89%|########8 | 911/1024 [00:53<00:06, 16.97it/s]Extracting embeddings:  89%|########9 | 913/1024 [00:53<00:06, 16.97it/s]Extracting embeddings:  89%|########9 | 915/1024 [00:53<00:06, 16.97it/s]Extracting embeddings:  90%|########9 | 917/1024 [00:54<00:06, 16.96it/s]Extracting embeddings:  90%|########9 | 919/1024 [00:54<00:06, 16.97it/s]Extracting embeddings:  90%|########9 | 921/1024 [00:54<00:06, 16.96it/s]Extracting embeddings:  90%|######### | 923/1024 [00:54<00:05, 16.96it/s]Extracting embeddings:  90%|######### | 925/1024 [00:54<00:05, 16.97it/s]Extracting embeddings:  91%|######### | 927/1024 [00:54<00:05, 16.96it/s]Extracting embeddings:  91%|######### | 929/1024 [00:54<00:05, 16.96it/s]Extracting embeddings:  91%|######### | 931/1024 [00:54<00:05, 16.96it/s]Extracting embeddings:  91%|#########1| 933/1024 [00:55<00:05, 16.97it/s]Extracting embeddings:  91%|#########1| 935/1024 [00:55<00:05, 16.97it/s]Extracting embeddings:  92%|#########1| 937/1024 [00:55<00:05, 16.97it/s]Extracting embeddings:  92%|#########1| 939/1024 [00:55<00:05, 16.97it/s]Extracting embeddings:  92%|#########1| 941/1024 [00:55<00:04, 16.98it/s]Extracting embeddings:  92%|#########2| 943/1024 [00:55<00:04, 16.97it/s]Extracting embeddings:  92%|#########2| 945/1024 [00:55<00:04, 16.90it/s]Extracting embeddings:  92%|#########2| 947/1024 [00:55<00:04, 16.91it/s]Extracting embeddings:  93%|#########2| 949/1024 [00:55<00:04, 16.93it/s]Extracting embeddings:  93%|#########2| 951/1024 [00:56<00:04, 16.94it/s]Extracting embeddings:  93%|#########3| 953/1024 [00:56<00:04, 16.94it/s]Extracting embeddings:  93%|#########3| 955/1024 [00:56<00:04, 16.95it/s]Extracting embeddings:  93%|#########3| 957/1024 [00:56<00:03, 16.96it/s]Extracting embeddings:  94%|#########3| 959/1024 [00:56<00:03, 16.96it/s]Extracting embeddings:  94%|#########3| 961/1024 [00:56<00:03, 16.97it/s]Extracting embeddings:  94%|#########4| 963/1024 [00:56<00:03, 16.97it/s]Extracting embeddings:  94%|#########4| 965/1024 [00:56<00:03, 16.98it/s]Extracting embeddings:  94%|#########4| 967/1024 [00:57<00:03, 16.98it/s]Extracting embeddings:  95%|#########4| 969/1024 [00:57<00:03, 16.98it/s]Extracting embeddings:  95%|#########4| 971/1024 [00:57<00:03, 16.97it/s]Extracting embeddings:  95%|#########5| 973/1024 [00:57<00:03, 16.97it/s]Extracting embeddings:  95%|#########5| 975/1024 [00:57<00:02, 16.97it/s]Extracting embeddings:  95%|#########5| 977/1024 [00:57<00:02, 16.97it/s]Extracting embeddings:  96%|#########5| 979/1024 [00:57<00:02, 16.97it/s]Extracting embeddings:  96%|#########5| 981/1024 [00:57<00:02, 16.97it/s]Extracting embeddings:  96%|#########5| 983/1024 [00:57<00:02, 16.97it/s]Extracting embeddings:  96%|#########6| 985/1024 [00:58<00:02, 16.97it/s]Extracting embeddings:  96%|#########6| 987/1024 [00:58<00:02, 16.97it/s]Extracting embeddings:  97%|#########6| 989/1024 [00:58<00:02, 16.97it/s]Extracting embeddings:  97%|#########6| 991/1024 [00:58<00:01, 16.97it/s]Extracting embeddings:  97%|#########6| 993/1024 [00:58<00:01, 16.97it/s]Extracting embeddings:  97%|#########7| 995/1024 [00:58<00:01, 16.98it/s]Extracting embeddings:  97%|#########7| 997/1024 [00:58<00:01, 16.99it/s]Extracting embeddings:  98%|#########7| 999/1024 [00:58<00:01, 16.98it/s]Extracting embeddings:  98%|#########7| 1001/1024 [00:59<00:01, 16.98it/s]Extracting embeddings:  98%|#########7| 1003/1024 [00:59<00:01, 16.96it/s]Extracting embeddings:  98%|#########8| 1005/1024 [00:59<00:01, 16.97it/s]Extracting embeddings:  98%|#########8| 1007/1024 [00:59<00:01, 16.96it/s]Extracting embeddings:  99%|#########8| 1009/1024 [00:59<00:00, 16.95it/s]Extracting embeddings:  99%|#########8| 1011/1024 [00:59<00:00, 16.95it/s]Extracting embeddings:  99%|#########8| 1013/1024 [00:59<00:00, 16.96it/s]Extracting embeddings:  99%|#########9| 1015/1024 [00:59<00:00, 16.96it/s]Extracting embeddings:  99%|#########9| 1017/1024 [00:59<00:00, 16.96it/s]Extracting embeddings: 100%|#########9| 1019/1024 [01:00<00:00, 16.96it/s]Extracting embeddings: 100%|#########9| 1021/1024 [01:00<00:00, 16.96it/s]Extracting embeddings: 100%|#########9| 1023/1024 [01:00<00:00, 16.96it/s]Extracting embeddings: 100%|##########| 1024/1024 [01:00<00:00, 16.96it/s]
  Embedding matrix shape: (32768, 384)

Computing PCA for n_samples=512...
  Computed 384 eigenvalues
  Top 10 eigenvalues: [9.7057097e-02 1.5451805e-02 6.9676060e-03 8.9087262e-04 2.3903682e-04
 1.0695420e-04 8.5277890e-05 3.5079480e-05 2.6549098e-05 1.7000179e-05]
  Variance explained by top 10: 99.94%

Computing PCA for n_samples=1024...
  Computed 384 eigenvalues
  Top 10 eigenvalues: [1.01357006e-01 1.42197125e-02 6.98808162e-03 8.02998664e-04
 2.32764796e-04 9.94976363e-05 8.00120761e-05 3.78957266e-05
 2.59009375e-05 1.58424773e-05]
  Variance explained by top 10: 99.95%

Computing PCA for n_samples=4096...
  Computed 384 eigenvalues
  Top 10 eigenvalues: [1.0457223e-01 1.2831661e-02 7.6384353e-03 8.7521173e-04 2.4286240e-04
 9.5656491e-05 8.1806982e-05 4.0170311e-05 2.8033077e-05 1.6584021e-05]
  Variance explained by top 10: 99.94%

Computing PCA for n_samples=8192...
  Computed 384 eigenvalues
  Top 10 eigenvalues: [1.0320107e-01 1.2692672e-02 7.4401596e-03 8.7440503e-04 2.3702167e-04
 9.5726944e-05 8.5067506e-05 4.2364933e-05 2.8088714e-05 1.6488737e-05]
  Variance explained by top 10: 99.94%

Computing PCA for n_samples=16384...
  Computed 384 eigenvalues
  Top 10 eigenvalues: [1.03010215e-01 1.23682730e-02 7.31618656e-03 8.89751944e-04
 2.41301299e-04 9.75789371e-05 8.49241696e-05 4.24922764e-05
 2.80320710e-05 1.62281303e-05]
  Variance explained by top 10: 99.94%

Computing PCA for n_samples=32768...
  Computed 384 eigenvalues
  Top 10 eigenvalues: [1.0376500e-01 1.2443681e-02 7.3582241e-03 9.1251289e-04 2.4123913e-04
 9.8500721e-05 8.6876120e-05 4.2174808e-05 2.8429826e-05 1.6096790e-05]
  Variance explained by top 10: 99.94%

Fitting full PCA for classification (n=32768)...

Saving checkpoint to: results/sep/v27/eigenspectrum_smarin_l4096_n512_1024_4096_8192_16384_32768_pmean.pkl

For n=32768:
  Components needed for 90% variance: 2
  Components needed for 95% variance: 3
  Effective sample size: 1.42485785
  Condition number: 1.01714695e+17

Figure saved to: results/sep/v27/eigenspectrum_smarin_n32768_l4096_pmean.png
PDF saved to: results/sep/v27/eigenspectrum_smarin_n32768_l4096_pmean.pdf
Eigenvalue data exported to: results/sep/v27/eigenspectrum_smarin_n32768_l4096_pmean.csv

======================================================================
PC SCALING ANALYSIS
Testing n_components: [0, 1, 2, 3, 4, 8, 16, 32, 64, 128, 256, 384]
======================================================================
Extracting sequence features:   0%|          | 0/32768 [00:00<?, ?it/s]Extracting sequence features:   2%|2         | 673/32768 [00:00<00:04, 6663.38it/s]Extracting sequence features:   4%|4         | 1396/32768 [00:00<00:04, 6990.64it/s]Extracting sequence features:   6%|6         | 2127/32768 [00:00<00:04, 7130.24it/s]Extracting sequence features:   9%|8         | 2857/32768 [00:00<00:04, 7193.24it/s]Extracting sequence features:  11%|#         | 3593/32768 [00:00<00:04, 7252.41it/s]Extracting sequence features:  13%|#3        | 4330/32768 [00:00<00:03, 7289.82it/s]Extracting sequence features:  15%|#5        | 5064/32768 [00:00<00:03, 7302.08it/s]Extracting sequence features:  18%|#7        | 5800/32768 [00:00<00:03, 7318.49it/s]Extracting sequence features:  20%|#9        | 6534/32768 [00:00<00:03, 7321.44it/s]Extracting sequence features:  22%|##2       | 7271/32768 [00:01<00:03, 7334.71it/s]Extracting sequence features:  24%|##4       | 8005/32768 [00:01<00:03, 7333.80it/s]Extracting sequence features:  27%|##6       | 8739/32768 [00:01<00:03, 7306.97it/s]Extracting sequence features:  29%|##8       | 9470/32768 [00:01<00:03, 7280.29it/s]Extracting sequence features:  31%|###1      | 10199/32768 [00:01<00:03, 7262.12it/s]Extracting sequence features:  33%|###3      | 10928/32768 [00:01<00:03, 7266.36it/s]Extracting sequence features:  36%|###5      | 11655/32768 [00:01<00:02, 7261.39it/s]Extracting sequence features:  38%|###7      | 12382/32768 [00:01<00:02, 7255.85it/s]Extracting sequence features:  40%|####      | 13108/32768 [00:01<00:02, 7249.48it/s]Extracting sequence features:  42%|####2     | 13835/32768 [00:01<00:02, 7254.60it/s]Extracting sequence features:  44%|####4     | 14561/32768 [00:02<00:02, 7244.72it/s]Extracting sequence features:  47%|####6     | 15288/32768 [00:02<00:02, 7240.75it/s]Extracting sequence features:  49%|####8     | 16019/32768 [00:02<00:02, 7248.40it/s]Extracting sequence features:  51%|#####1    | 16744/32768 [00:02<00:02, 7248.24it/s]Extracting sequence features:  53%|#####3    | 17469/32768 [00:02<00:02, 7246.25it/s]Extracting sequence features:  56%|#####5    | 18194/32768 [00:02<00:02, 7233.10it/s]Extracting sequence features:  58%|#####7    | 18924/32768 [00:02<00:01, 7251.26it/s]Extracting sequence features:  60%|#####9    | 19650/32768 [00:02<00:01, 7243.01it/s]Extracting sequence features:  62%|######2   | 20377/32768 [00:02<00:01, 7250.05it/s]Extracting sequence features:  64%|######4   | 21103/32768 [00:02<00:01, 7246.92it/s]Extracting sequence features:  67%|######6   | 21828/32768 [00:03<00:01, 7232.96it/s]Extracting sequence features:  69%|######8   | 22555/32768 [00:03<00:01, 7240.03it/s]Extracting sequence features:  71%|#######1  | 23280/32768 [00:03<00:01, 7240.50it/s]Extracting sequence features:  73%|#######3  | 24006/32768 [00:03<00:01, 7245.80it/s]Extracting sequence features:  75%|#######5  | 24731/32768 [00:03<00:01, 7243.40it/s]Extracting sequence features:  78%|#######7  | 25457/32768 [00:03<00:01, 7246.68it/s]Extracting sequence features:  80%|#######9  | 26182/32768 [00:03<00:00, 7238.07it/s]Extracting sequence features:  82%|########2 | 26910/32768 [00:03<00:00, 7247.75it/s]Extracting sequence features:  84%|########4 | 27635/32768 [00:03<00:00, 7246.19it/s]Extracting sequence features:  87%|########6 | 28360/32768 [00:03<00:00, 7242.71it/s]Extracting sequence features:  89%|########8 | 29085/32768 [00:04<00:00, 7238.71it/s]Extracting sequence features:  91%|######### | 29814/32768 [00:04<00:00, 7253.51it/s]Extracting sequence features:  93%|#########3| 30540/32768 [00:04<00:00, 7238.98it/s]Extracting sequence features:  95%|#########5| 31264/32768 [00:04<00:00, 7233.67it/s]Extracting sequence features:  98%|#########7| 31988/32768 [00:04<00:00, 7230.45it/s]Extracting sequence features: 100%|#########9| 32712/32768 [00:04<00:00, 7227.71it/s]Extracting sequence features: 100%|##########| 32768/32768 [00:04<00:00, 7246.13it/s]
[species[n_comp=0]] 1 classes, 32768 samples
  Classes: Zmays
/work/10459/eczech/vista/envs/ml-rel/lib/python3.11/site-packages/sklearn/metrics/_ranking.py:379: UndefinedMetricWarning: Only one class is present in y_true. ROC AUC score is not defined in that case.
  warnings.warn(
Warning: Could not compute AUPRC for species[n_comp=0]: y should be a 1d array, got an array of shape (6554, 2) instead.
/work/10459/eczech/vista/envs/ml-rel/lib/python3.11/site-packages/sklearn/metrics/_ranking.py:379: UndefinedMetricWarning: Only one class is present in y_true. ROC AUC score is not defined in that case.
  warnings.warn(
Warning: Could not compute AUPRC for species[n_comp=1]: y should be a 1d array, got an array of shape (6554, 2) instead.
/work/10459/eczech/vista/envs/ml-rel/lib/python3.11/site-packages/sklearn/metrics/_ranking.py:379: UndefinedMetricWarning: Only one class is present in y_true. ROC AUC score is not defined in that case.
  warnings.warn(
Warning: Could not compute AUPRC for species[n_comp=2]: y should be a 1d array, got an array of shape (6554, 2) instead.
/work/10459/eczech/vista/envs/ml-rel/lib/python3.11/site-packages/sklearn/metrics/_ranking.py:379: UndefinedMetricWarning: Only one class is present in y_true. ROC AUC score is not defined in that case.
  warnings.warn(
Warning: Could not compute AUPRC for species[n_comp=3]: y should be a 1d array, got an array of shape (6554, 2) instead.
/work/10459/eczech/vista/envs/ml-rel/lib/python3.11/site-packages/sklearn/metrics/_ranking.py:379: UndefinedMetricWarning: Only one class is present in y_true. ROC AUC score is not defined in that case.
  warnings.warn(
Warning: Could not compute AUPRC for species[n_comp=4]: y should be a 1d array, got an array of shape (6554, 2) instead.
/work/10459/eczech/vista/envs/ml-rel/lib/python3.11/site-packages/sklearn/metrics/_ranking.py:379: UndefinedMetricWarning: Only one class is present in y_true. ROC AUC score is not defined in that case.
  warnings.warn(
Warning: Could not compute AUPRC for species[n_comp=8]: y should be a 1d array, got an array of shape (6554, 2) instead.
/work/10459/eczech/vista/envs/ml-rel/lib/python3.11/site-packages/sklearn/metrics/_ranking.py:379: UndefinedMetricWarning: Only one class is present in y_true. ROC AUC score is not defined in that case.
  warnings.warn(
Warning: Could not compute AUPRC for species[n_comp=16]: y should be a 1d array, got an array of shape (6554, 2) instead.
/work/10459/eczech/vista/envs/ml-rel/lib/python3.11/site-packages/sklearn/metrics/_ranking.py:379: UndefinedMetricWarning: Only one class is present in y_true. ROC AUC score is not defined in that case.
  warnings.warn(
Warning: Could not compute AUPRC for species[n_comp=32]: y should be a 1d array, got an array of shape (6554, 2) instead.
/work/10459/eczech/vista/envs/ml-rel/lib/python3.11/site-packages/sklearn/metrics/_ranking.py:379: UndefinedMetricWarning: Only one class is present in y_true. ROC AUC score is not defined in that case.
  warnings.warn(
Warning: Could not compute AUPRC for species[n_comp=64]: y should be a 1d array, got an array of shape (6554, 2) instead.
/work/10459/eczech/vista/envs/ml-rel/lib/python3.11/site-packages/sklearn/metrics/_ranking.py:379: UndefinedMetricWarning: Only one class is present in y_true. ROC AUC score is not defined in that case.
  warnings.warn(
Warning: Could not compute AUPRC for species[n_comp=128]: y should be a 1d array, got an array of shape (6554, 2) instead.
/work/10459/eczech/vista/envs/ml-rel/lib/python3.11/site-packages/sklearn/metrics/_ranking.py:379: UndefinedMetricWarning: Only one class is present in y_true. ROC AUC score is not defined in that case.
  warnings.warn(
Warning: Could not compute AUPRC for species[n_comp=256]: y should be a 1d array, got an array of shape (6554, 2) instead.
/work/10459/eczech/vista/envs/ml-rel/lib/python3.11/site-packages/sklearn/metrics/_ranking.py:379: UndefinedMetricWarning: Only one class is present in y_true. ROC AUC score is not defined in that case.
  warnings.warn(
Warning: Could not compute AUPRC for species[n_comp=384]: y should be a 1d array, got an array of shape (6554, 2) instead.
  species              Performance by n_components:
    Accuracy:  1.000 1.000 1.000 1.000 1.000 1.000 1.000 1.000 1.000 1.000 1.000 1.000
    F1:        1.000 1.000 1.000 1.000 1.000 1.000 1.000 1.000 1.000 1.000 1.000 1.000
    ROC AUC:     nan   nan   nan   nan   nan   nan   nan   nan   nan   nan   nan   nan
    AUPRC:       nan   nan   nan   nan   nan   nan   nan   nan   nan   nan   nan   nan
[gc_content[n_comp=0]] 5 classes, 32768 samples
  Classes: 0.293-0.410, 0.410-0.435, 0.435-0.461, 0.461-0.501, 0.501-0.671
  gc_content           Performance by n_components:
    Accuracy:  0.201 0.819 0.850 0.856 0.857 0.925 0.939 0.939 0.939 0.937 0.933 0.933
    F1:        0.201 0.820 0.851 0.856 0.857 0.925 0.939 0.939 0.939 0.937 0.933 0.933
    ROC AUC:   0.496 0.972 0.979 0.980 0.982 0.994 0.996 0.996 0.996 0.996 0.996 0.995
    AUPRC:     0.200 0.881 0.912 0.917 0.923 0.976 0.984 0.983 0.983 0.982 0.982 0.981
[repeat_fraction[n_comp=0]] 5 classes, 32768 samples
  Classes: 0.000-0.010, 0.010-0.038, 0.038-0.117, 0.117-0.437, 0.437-1.000
  repeat_fraction      Performance by n_components:
    Accuracy:  0.202 0.245 0.283 0.301 0.348 0.423 0.460 0.478 0.485 0.494 0.502 0.504
    F1:        0.201 0.235 0.276 0.295 0.340 0.414 0.453 0.472 0.480 0.490 0.497 0.499
    ROC AUC:   0.500 0.565 0.615 0.633 0.681 0.746 0.778 0.792 0.796 0.803 0.805 0.806
    AUPRC:     0.199 0.247 0.295 0.315 0.357 0.435 0.478 0.498 0.502 0.514 0.515 0.520
[kmer_entropy_1[n_comp=0]] 5 classes, 32768 samples
  Classes: 1.865-1.970, 1.970-1.982, 1.982-1.989, 1.989-1.995, 1.995-2.000
  kmer_entropy_1       Performance by n_components:
    Accuracy:  0.199 0.696 0.753 0.795 0.807 0.865 0.881 0.877 0.872 0.866 0.865 0.866
    F1:        0.199 0.692 0.753 0.796 0.807 0.865 0.881 0.878 0.873 0.867 0.866 0.867
    ROC AUC:   0.492 0.920 0.945 0.963 0.967 0.984 0.986 0.986 0.985 0.984 0.983 0.982
    AUPRC:     0.197 0.714 0.792 0.853 0.866 0.935 0.946 0.943 0.939 0.935 0.932 0.930
[kmer_entropy_3[n_comp=0]] 5 classes, 32768 samples
  Classes: 4.840-5.858, 5.858-5.898, 5.898-5.925, 5.925-5.946, 5.946-5.988
  kmer_entropy_3       Performance by n_components:
    Accuracy:  0.198 0.608 0.637 0.675 0.687 0.755 0.781 0.778 0.783 0.777 0.770 0.776
    F1:        0.198 0.602 0.636 0.674 0.687 0.756 0.782 0.779 0.784 0.778 0.771 0.776
    ROC AUC:   0.496 0.874 0.893 0.916 0.922 0.948 0.958 0.958 0.959 0.957 0.955 0.955
    AUPRC:     0.199 0.611 0.650 0.710 0.725 0.798 0.836 0.835 0.836 0.834 0.828 0.826
[kmer_entropy_9[n_comp=0]] 5 classes, 32768 samples
  Classes: 8.267-11.898, 11.898-11.933, 11.933-11.948, 11.948-11.960, 11.960-11.984
  kmer_entropy_9       Performance by n_components:
    Accuracy:  0.203 0.251 0.266 0.277 0.332 0.395 0.410 0.420 0.431 0.435 0.435 0.436
    F1:        0.203 0.239 0.260 0.272 0.321 0.389 0.406 0.418 0.430 0.433 0.434 0.433
    ROC AUC:   0.505 0.557 0.587 0.595 0.656 0.716 0.738 0.745 0.759 0.761 0.760 0.760
    AUPRC:     0.203 0.244 0.271 0.284 0.339 0.407 0.434 0.442 0.456 0.458 0.457 0.457
[dinuc_CG[n_comp=0]] 5 classes, 32768 samples
  Classes: 0.004-0.026, 0.026-0.035, 0.035-0.044, 0.044-0.059, 0.059-0.134
  dinuc_CG             Performance by n_components:
    Accuracy:  0.198 0.647 0.647 0.655 0.714 0.831 0.870 0.870 0.870 0.864 0.864 0.859
    F1:        0.197 0.650 0.650 0.658 0.717 0.832 0.871 0.871 0.871 0.864 0.865 0.860
    ROC AUC:   0.497 0.900 0.904 0.909 0.936 0.974 0.984 0.984 0.983 0.983 0.982 0.981
    AUPRC:     0.200 0.669 0.689 0.701 0.766 0.895 0.932 0.933 0.932 0.931 0.926 0.922
[dinuc_GC[n_comp=0]] 5 classes, 32768 samples
  Classes: 0.016-0.044, 0.044-0.051, 0.051-0.058, 0.058-0.069, 0.069-0.129
  dinuc_GC             Performance by n_components:
    Accuracy:  0.188 0.610 0.635 0.639 0.649 0.664 0.697 0.709 0.730 0.747 0.734 0.733
    F1:        0.185 0.609 0.636 0.640 0.650 0.665 0.698 0.709 0.731 0.747 0.734 0.732
    ROC AUC:   0.489 0.890 0.902 0.903 0.905 0.915 0.926 0.934 0.941 0.944 0.943 0.941
    AUPRC:     0.193 0.641 0.670 0.673 0.677 0.702 0.732 0.754 0.773 0.783 0.781 0.773
[dinuc_AT[n_comp=0]] 5 classes, 32768 samples
  Classes: 0.021-0.061, 0.061-0.071, 0.071-0.078, 0.078-0.085, 0.085-0.132
  dinuc_AT             Performance by n_components:
    Accuracy:  0.193 0.585 0.589 0.587 0.610 0.669 0.680 0.701 0.714 0.718 0.716 0.717
    F1:        0.193 0.592 0.595 0.593 0.613 0.670 0.682 0.703 0.715 0.720 0.718 0.719
    ROC AUC:   0.497 0.867 0.870 0.872 0.884 0.913 0.917 0.927 0.932 0.934 0.934 0.934
    AUPRC:     0.199 0.604 0.615 0.621 0.640 0.701 0.710 0.735 0.748 0.755 0.756 0.756
[dinuc_TA[n_comp=0]] 5 classes, 32768 samples
  Classes: 0.012-0.049, 0.049-0.057, 0.057-0.064, 0.064-0.072, 0.072-0.121
  dinuc_TA             Performance by n_components:
    Accuracy:  0.199 0.498 0.512 0.528 0.582 0.719 0.750 0.760 0.764 0.763 0.754 0.753
    F1:        0.197 0.500 0.516 0.530 0.582 0.719 0.751 0.760 0.764 0.763 0.754 0.753
    ROC AUC:   0.500 0.820 0.831 0.838 0.869 0.937 0.948 0.952 0.952 0.952 0.950 0.949
    AUPRC:     0.200 0.531 0.551 0.562 0.616 0.765 0.801 0.813 0.816 0.815 0.808 0.806
[dinuc_AA[n_comp=0]] 5 classes, 32768 samples
  Classes: 0.011-0.064, 0.064-0.074, 0.074-0.081, 0.081-0.090, 0.090-0.170
  dinuc_AA             Performance by n_components:
    Accuracy:  0.201 0.388 0.586 0.608 0.610 0.640 0.700 0.704 0.719 0.714 0.710 0.713
    F1:        0.200 0.367 0.587 0.610 0.612 0.641 0.702 0.705 0.719 0.715 0.710 0.713
    ROC AUC:   0.498 0.717 0.868 0.883 0.887 0.902 0.930 0.930 0.935 0.934 0.934 0.933
    AUPRC:     0.199 0.390 0.614 0.642 0.651 0.682 0.745 0.745 0.759 0.756 0.759 0.754
[dinuc_TT[n_comp=0]] 5 classes, 32768 samples
  Classes: 0.010-0.068, 0.068-0.082, 0.082-0.092, 0.092-0.104, 0.104-0.170
  dinuc_TT             Performance by n_components:
    Accuracy:  0.194 0.547 0.643 0.663 0.680 0.713 0.766 0.773 0.774 0.776 0.773 0.768
    F1:        0.194 0.549 0.646 0.665 0.681 0.714 0.768 0.774 0.775 0.777 0.774 0.769
    ROC AUC:   0.496 0.843 0.904 0.914 0.921 0.935 0.955 0.957 0.956 0.957 0.955 0.954
    AUPRC:     0.199 0.557 0.672 0.697 0.715 0.754 0.815 0.821 0.820 0.822 0.816 0.810

PC scaling curves saved to: results/sep/v27/pc_scaling_curves.png
PC scaling curves PDF saved to: results/sep/v27/pc_scaling_curves.pdf
PC scaling data exported to: results/sep/v27/pc_scaling_curves.csv

======================================================================
SUMMARY: F1 by n_components
======================================================================
Target                     0       1       2       3       4       8      16      32      64     128     256     384
--------------------------------------------------------------------------------------------------------------------
dinuc_AA               0.200   0.367   0.587   0.610   0.612   0.641   0.702   0.705   0.719   0.715   0.710   0.713
dinuc_AT               0.193   0.592   0.595   0.593   0.613   0.670   0.682   0.703   0.715   0.720   0.718   0.719
dinuc_CG               0.197   0.650   0.650   0.658   0.717   0.832   0.871   0.871   0.871   0.864   0.865   0.860
dinuc_GC               0.185   0.609   0.636   0.640   0.650   0.665   0.698   0.709   0.731   0.747   0.734   0.732
dinuc_TA               0.197   0.500   0.516   0.530   0.582   0.719   0.751   0.760   0.764   0.763   0.754   0.753
dinuc_TT               0.194   0.549   0.646   0.665   0.681   0.714   0.768   0.774   0.775   0.777   0.774   0.769
gc_content             0.201   0.820   0.851   0.856   0.857   0.925   0.939   0.939   0.939   0.937   0.933   0.933
kmer_entropy_1         0.199   0.692   0.753   0.796   0.807   0.865   0.881   0.878   0.873   0.867   0.866   0.867
kmer_entropy_3         0.198   0.602   0.636   0.674   0.687   0.756   0.782   0.779   0.784   0.778   0.771   0.776
kmer_entropy_9         0.203   0.239   0.260   0.272   0.321   0.389   0.406   0.418   0.430   0.433   0.434   0.433
repeat_fraction        0.201   0.235   0.276   0.295   0.340   0.414   0.453   0.472   0.480   0.490   0.497   0.499
species                1.000   1.000   1.000   1.000   1.000   1.000   1.000   1.000   1.000   1.000   1.000   1.000

Training species classifier with n_components=384 PCs...
[Species] 1 classes, 32768 samples
  Classes: Zmays

[Species] n_classes=1, acc=1.000, f1=1.000
/work/10459/eczech/vista/envs/ml-rel/lib/python3.11/site-packages/sklearn/metrics/_classification.py:407: UserWarning: A single label was found in 'y_true' and 'y_pred'. For the confusion matrix to have the correct shape, use the 'labels' parameter to pass all known labels.
  warnings.warn(
Confusion matrix saved to: results/sep/v27/eigenspectrum_smarin_n32768_l4096_pmean_confusion_matrix.png
Confusion matrix PDF saved to: results/sep/v27/eigenspectrum_smarin_n32768_l4096_pmean_confusion_matrix.pdf
Confusion matrix data exported to: results/sep/v27/eigenspectrum_smarin_n32768_l4096_pmean_confusion_matrix.csv
Classification metrics exported to: results/sep/v27/eigenspectrum_smarin_n32768_l4096_pmean_confusion_matrix_metrics.csv

Run completed: 2026-01-01T05:27:53.314007

Done!
